{
  "captured_at": "2026-04-24T05:51:34Z",
  "chief_state": {
    "agent_id": "48251656-cdc5-48e3-804d-4fd338614b7b",
    "mcp_config": null,
    "model": "gpt-5.5",
    "reasoning_effort": "xhigh",
    "skills": []
  },
  "hermes_config_summary": {
    "agent": {
      "reasoning_effort": "xhigh"
    },
    "mcp_server_names": [
      "chatgptrest"
    ],
    "model": {
      "api_mode": "anthropic_messages",
      "base_url": "https://api.minimaxi.com/anthropic",
      "default": "gpt-5.5",
      "provider": "openai-codex"
    },
    "skills": {
      "external_dirs": [
        "/vol1/1000/projects/planning/hermes-skills"
      ]
    }
  },
  "issues": [
    {
      "action_class": "implementation",
      "contract": {
        "full": false
      },
      "created_at": "2026-04-24T12:43:56+08:00",
      "dependencies": [],
      "id": "7009c945-3bbb-43c7-a7f2-4a9565d096d5",
      "identifier": "ASF-26",
      "number": 26,
      "priority": "high",
      "project_id": "49739a3a-c385-4178-9174-534fdc9470c0",
      "project_priority": "none",
      "red_team": {
        "independence_grade": "C",
        "status": "not_started"
      },
      "risk_class": "high",
      "sidecar_unlock_order": null,
      "source_defaults": {
        "action_class": "conservative_default",
        "contract.full": "conservative_default",
        "red_team": "conservative_default",
        "risk_class": "conservative_default"
      },
      "status": "done",
      "title": "Build cross-workspace evidence bundle exporter",
      "workspace_id": "6aa0f38c-1f97-4fbb-a4ff-d48eb0d3a580"
    },
    {
      "action_class": "implementation",
      "contract": {
        "full": false
      },
      "created_at": "2026-04-24T12:20:43+08:00",
      "dependencies": [],
      "id": "0e5bd1ff-bed2-4821-bccd-d4b6353150f6",
      "identifier": "ASF-25",
      "number": 25,
      "priority": "high",
      "project_id": "49739a3a-c385-4178-9174-534fdc9470c0",
      "project_priority": "none",
      "red_team": {
        "independence_grade": "C",
        "status": "not_started"
      },
      "risk_class": "high",
      "sidecar_unlock_order": null,
      "source_defaults": {
        "action_class": "conservative_default",
        "contract.full": "conservative_default",
        "red_team": "conservative_default",
        "risk_class": "conservative_default"
      },
      "status": "done",
      "title": "Compile proof ledger and sidecar knowledge register",
      "workspace_id": "6aa0f38c-1f97-4fbb-a4ff-d48eb0d3a580"
    },
    {
      "action_class": "implementation",
      "contract": {
        "full": false
      },
      "created_at": "2026-04-24T11:58:46+08:00",
      "dependencies": [],
      "id": "a5112244-2f3f-4444-a335-59466d18d656",
      "identifier": "ASF-24",
      "number": 24,
      "priority": "high",
      "project_id": "49739a3a-c385-4178-9174-534fdc9470c0",
      "project_priority": "none",
      "red_team": {
        "independence_grade": "C",
        "status": "not_started"
      },
      "risk_class": "high",
      "sidecar_unlock_order": null,
      "source_defaults": {
        "action_class": "conservative_default",
        "contract.full": "conservative_default",
        "red_team": "conservative_default",
        "risk_class": "conservative_default"
      },
      "status": "done",
      "title": "Implement read-only chief live snapshot exporter",
      "workspace_id": "6aa0f38c-1f97-4fbb-a4ff-d48eb0d3a580"
    },
    {
      "action_class": "implementation",
      "contract": {
        "full": false
      },
      "created_at": "2026-04-24T11:31:59+08:00",
      "dependencies": [],
      "id": "d9891a85-976c-4427-99fa-041762319d6c",
      "identifier": "ASF-23",
      "number": 23,
      "priority": "high",
      "project_id": "49739a3a-c385-4178-9174-534fdc9470c0",
      "project_priority": "none",
      "red_team": {
        "independence_grade": "C",
        "status": "not_started"
      },
      "risk_class": "high",
      "sidecar_unlock_order": null,
      "source_defaults": {
        "action_class": "conservative_default",
        "contract.full": "conservative_default",
        "red_team": "conservative_default",
        "risk_class": "conservative_default"
      },
      "status": "done",
      "title": "Implement runnable chief manifest and advance_one dry-run harness",
      "workspace_id": "6aa0f38c-1f97-4fbb-a4ff-d48eb0d3a580"
    },
    {
      "action_class": "implementation",
      "contract": {
        "full": false
      },
      "created_at": "2026-04-23T23:16:34+08:00",
      "dependencies": [],
      "id": "289487e8-cc5f-447d-a5f7-0268f390176e",
      "identifier": "ASF-22",
      "number": 22,
      "priority": "high",
      "project_id": "9e7e7c7c-54ec-4208-af60-543aad42d2a6",
      "project_priority": "none",
      "red_team": {
        "independence_grade": "C",
        "status": "not_started"
      },
      "risk_class": "high",
      "sidecar_unlock_order": null,
      "source_defaults": {
        "action_class": "conservative_default",
        "contract.full": "conservative_default",
        "red_team": "conservative_default",
        "risk_class": "conservative_default"
      },
      "status": "done",
      "title": "Harness0 golden path: executable planning-memory case_01 proof",
      "workspace_id": "6aa0f38c-1f97-4fbb-a4ff-d48eb0d3a580"
    },
    {
      "action_class": "implementation",
      "contract": {
        "full": false
      },
      "created_at": "2026-04-23T16:29:31+08:00",
      "dependencies": [],
      "id": "e8b8198f-16bc-4254-af1f-a1ed2b889998",
      "identifier": "ASF-21",
      "number": 21,
      "priority": "none",
      "project_id": "9e7e7c7c-54ec-4208-af60-543aad42d2a6",
      "project_priority": "none",
      "red_team": {
        "independence_grade": "C",
        "status": "not_started"
      },
      "risk_class": "high",
      "sidecar_unlock_order": null,
      "source_defaults": {
        "action_class": "conservative_default",
        "contract.full": "conservative_default",
        "red_team": "conservative_default",
        "risk_class": "conservative_default"
      },
      "status": "done",
      "title": "Cross-workspace dispatch smoke worker ack",
      "workspace_id": "6aa0f38c-1f97-4fbb-a4ff-d48eb0d3a580"
    },
    {
      "action_class": "implementation",
      "contract": {
        "full": false
      },
      "created_at": "2026-04-23T15:58:05+08:00",
      "dependencies": [],
      "id": "3f691de2-01b4-483f-a6bc-d03b9d3ad697",
      "identifier": "ASF-20",
      "number": 20,
      "priority": "medium",
      "project_id": "f005948f-c46e-4c5f-a645-f4bf94432baa",
      "project_priority": "none",
      "red_team": {
        "independence_grade": "C",
        "status": "not_started"
      },
      "risk_class": "high",
      "sidecar_unlock_order": null,
      "source_defaults": {
        "action_class": "conservative_default",
        "contract.full": "conservative_default",
        "red_team": "conservative_default",
        "risk_class": "conservative_default"
      },
      "status": "todo",
      "title": "梳理儿子语音助手设想与依赖",
      "workspace_id": "6aa0f38c-1f97-4fbb-a4ff-d48eb0d3a580"
    },
    {
      "action_class": "implementation",
      "contract": {
        "full": false
      },
      "created_at": "2026-04-23T15:58:05+08:00",
      "dependencies": [],
      "id": "60a3fb3e-bc79-4fbd-9dcf-8b434547d5cc",
      "identifier": "ASF-19",
      "number": 19,
      "priority": "medium",
      "project_id": "f005948f-c46e-4c5f-a645-f4bf94432baa",
      "project_priority": "none",
      "red_team": {
        "independence_grade": "C",
        "status": "not_started"
      },
      "risk_class": "high",
      "sidecar_unlock_order": null,
      "source_defaults": {
        "action_class": "conservative_default",
        "contract.full": "conservative_default",
        "red_team": "conservative_default",
        "risk_class": "conservative_default"
      },
      "status": "todo",
      "title": "梳理教育专家助理需求与现有材料",
      "workspace_id": "6aa0f38c-1f97-4fbb-a4ff-d48eb0d3a580"
    },
    {
      "action_class": "implementation",
      "contract": {
        "full": false
      },
      "created_at": "2026-04-23T15:58:05+08:00",
      "dependencies": [],
      "id": "c9cd4e0a-a36d-40a0-9eee-ff045c89439b",
      "identifier": "ASF-18",
      "number": 18,
      "priority": "medium",
      "project_id": "49739a3a-c385-4178-9174-534fdc9470c0",
      "project_priority": "none",
      "red_team": {
        "independence_grade": "C",
        "status": "not_started"
      },
      "risk_class": "high",
      "sidecar_unlock_order": null,
      "source_defaults": {
        "action_class": "conservative_default",
        "contract.full": "conservative_default",
        "red_team": "conservative_default",
        "risk_class": "conservative_default"
      },
      "status": "done",
      "title": "Chief manifest and transition checker design baseline",
      "workspace_id": "6aa0f38c-1f97-4fbb-a4ff-d48eb0d3a580"
    },
    {
      "action_class": "implementation",
      "contract": {
        "full": false
      },
      "created_at": "2026-04-23T15:58:05+08:00",
      "dependencies": [],
      "id": "e370354b-6de1-40f1-8122-58b44a4bca20",
      "identifier": "ASF-17",
      "number": 17,
      "priority": "medium",
      "project_id": "49739a3a-c385-4178-9174-534fdc9470c0",
      "project_priority": "none",
      "red_team": {
        "independence_grade": "C",
        "status": "not_started"
      },
      "risk_class": "high",
      "sidecar_unlock_order": null,
      "source_defaults": {
        "action_class": "conservative_default",
        "contract.full": "conservative_default",
        "red_team": "conservative_default",
        "risk_class": "conservative_default"
      },
      "status": "done",
      "title": "设计 Hermes 总控 prompt 与 specialist routing",
      "workspace_id": "6aa0f38c-1f97-4fbb-a4ff-d48eb0d3a580"
    },
    {